Location,Name,Description,Latitude,Longitude,Altitude,Map
"Hidden Valley Road, Clark County, Nevada, United States",Hidden Valley Road Option #2,This is a perfectly flat gravel parking area maybe nearly as large as a football field and it's wide open. Traffic noise is not too bad.....sleeping was not a problem. Certainly not the cleanest area so use a flashnight at night. Verizon service was pretty good here.,36.640397,-114.603082,491.84619140625
"Narramore Road, Buckeye, Maricopa County, Arizona, 85343, United States",Buckeye BLM,"There are lots of places for dispersed camping here. Unfortunately there is so, so much trash. We picked up the trash in our area and left it at the gazebo near the entrance, which I've heard is maintained by the county.  This place is convenient because of its proximity to Buckeye, and its easy roads in (level dirt, some washboard).  But the amount of garbage and shooting debris (shells and garbage that's been shot up) makes it kind of a depressing place.  Decent Verizon and AT&T reception. ",33.3114,-112.6373,241.6
"8746, West Carefree Highway, Peoria, Maricopa County, Arizona, 85383, United States",Arizona Land Trust Permit Required,"Open area with dispersed camping. Good cell signal and quiet. Big rig friendly. You can order a permit online, very easy! Just search Arizona Land Trust permit.",33.809693,-112.246106,494.6458191042766
"24413, Crenshaw Boulevard, Lomita, Los Angeles County, CAL Fire Southern Region, California, 90717, United States",Mall parking lot,Nice quiet parking lot. Home Depot and other stores here. Lots of other campers here too. Also campers in the Sam’s club on the other side of Home Depot ,33.803809,-118.32885,23.6493399431929
"4110, Santiago Street, Southpark, Austin, Travis County, Texas, 78745, United States",Santiago St,"A quiet street behind a hotel. Some tree shade. Other trucks and cars campers overnight. The nearby Walmart does not allow overnight, the one 4 miles to the west does.",30.215435,-97.75466,188.6102339644725
"2934, Hunter Fish Camp Road, Jackson County, Florida, 32446, United States",Merritts Mill Pond Boat Launch,"When the trails and boat launch at Cavern State Park in Florida were closed due to flooding and storm damage, we asked the ranger of another place to kayak. He directed us to the boat launch for Merritts Mill Pond off Hunter Fish Camp Road, west of Marianna, Florida. There’s a large parking lot where we stayed overnight. The parking was a tiny bit slanted but not bad. Big rigs could fit in but probably not advisable because boat trailers need room to park unless you come late and leave early. It was fantastic. The pond (about four or more miles long) has at least four springs coming into it so it’s crystal clear with cypress tree groves on each side. We went left and paddled up to Blue Springs Recreation Area at the end.",30.77987,-85.16831,-4.45196533203125
"Troy Road, San Bernardino County, California, United States",Rodman Mountains Canyon,"Remote place to camp on the side of the trail. Road in is rough but we did bring our small trailer. Hiking in the canyon was easy but cool rock formations to see. Huge area for pets to run around for lots of sniffs, if good off leash. ",34.74949,-116.66158,621.1454453309998
"Hackamore Road, Apache Junction, Pinal County, Arizona, 85270, United States",Public land near ohv,"Sign posted when the road turns to to dirt 14 days Max stay. 

The road in had a lot of bumps and holes but going slow you should have no trouble getting in for most vehicles. 

Verizon service seems hit and miss, there may be better at different spots. There are several pull offs, some with fire rings, we didn’t go all the way down the road I am sure there is more. 

No facilities and no trash, so please pack it out. 


There were a few people setup in tents nearby as well. ",33.458857,-111.508376,616.4074852317572
"Mineral County, Nevada, United States",Tamarack Beach on Walker Lake,"On public land, can drive right up to water’s edge if you like. Freeway behind but not a bother if you’re far enough away which is definitely possible. Toilet in parking lot. Wasn’t crowded in January with about 3 other RVs/trailers. 2-3 bars LTE w US Cellular. Can get windy!!",38.738328,-118.761205,1197.5932273864746
"5012, Dames Ferry Road, Monroe County, Georgia, 31046, United States",Georgia Camping Area (Goose Road Camp),Clearing right off the highway down a dirt road. Easy to miss turn off. Passed it twice because of tail-gaters and not wanting to slam on the breaks. Fork is almost immediate. Keep right to pass up into the clearing. A couple of fire pits and ample space to pick your spot. Won’t be private if there’s anyone else. It’s really just a clearing. You can hear the traffic from the highway through the trees but it got quiet over night. ,33.029891,-83.791319,155.4395863050595
"Red Roof PLUS+ & Suites Naples Downtown-5th Ave S, 1925, Davis Boulevard, Naples, Collier County, Florida, 34104, United States",Overgrown Parking Lot,"Located behind Red Roof Inn alongside a small lake and right beside the airport.

On December 2022, construction going on and lot of airplanes taking off.

This parking lot doesn’t seem to be affiliated with either hotel because it’s not swept and many of the bushes are growing well into the parking spaces.

There's 2 containers to hide behind and from the light.",26.139934,-81.781533,6.6
"La Paz County, Arizona, United States",Near Interstate,"lots of space. big rig friendly. lots of empty space right off the freeway but you can get far enough away to minimize road noise

",33.680702,-114.086633,416.6209716796875
"74, Lewis Road, Truth or Consequences, Sierra County, New Mexico, 87935, United States",County Road pull off ,"This spot is just a short distance away from the BLM boundary line. This quiet dirt county road, located off a frontage road services road, only a remote RV park with a main entrance on the other side. Very quiet. There are a couple pull off options just past the cattle guard. this makes a very easy and nice overnight.  ",33.202845,-107.249912,1396.2817298695445
"480, Capistrano Road, Princeton-by-the-Sea, San Mateo County, CAL Fire Northern Region, California, 94019, United States",Veggie Farm turnout,"Nice little turnout seems to be friendly to overnight camping, We were not bothered by the police, other overlanders camping here. Close to Mavericks beach",37.505859,-122.486757,10.48668455798179
"Happy Camp Canyon Road, Cochise County, Arizona, United States",Just BEFORE Indian Bread Cul-de-Sac,Just off the road that leads to Indian Bread Rocks day use parking. Spacious and level. Good cell. Super private! ,32.237563,-109.488264,1213.5079345703125
"US-60, Socorro County, New Mexico, United States",rest area ,"This is a rest area on RT 60. the law allows parking for 24 hrs. I pulled over on the way to VLA observatory cuz it was snowing, I tried ""the box"" east of this location but didnt have a good cell signal (att) at the trailhead, so I came here and had full signal.",34.019032,-107.038408,1844.1697308228668
"Dillahunty Road, Eddy County, New Mexico, United States",dillahunty rd,"Further down dillahunty rd, found this side road. Bumpy but doable slowly in camper van. Nice views, quiet. Intermittent LTE.",32.065507,-104.399202,1134.823486328125
"Steep Hill Road, La Luz, Otero County, New Mexico, United States",Steep Hill Rd,"Near Alamogordo on the way to Cloudcroft, no signs saying no overnight parking. There are a couple of pulloffs here (4?), first one is fairly level, I'm in a skoolie. Views are spectacular. I walked down the steep hill to see if there were any other spots, didn't see anything but the road is wide and well maintained, met a couple of dirt bikes. Some road noise but not horrible. Manageable Verizon signal. ",32.94851,-105.87586,1765.9
"20255, West Manville Road, Pima County, Arizona, 85653, United States",Ironwood NM flat pullout,There were people parked at the Agua Blanca entrance and one other pullout after so I kept driving and found this large flat pullout. Big enough for multiple vehicles. Came in with a 2WD Sprinter Van okay. Def bumpy and can get a little tight with branches for a bit. Watch for grazing cows. Had a couple surprise me. Great views. 2 bars TMobile.,32.289756,-111.380745,656.1075096232817
"Taos County, New Mexico, United States",West Rim Rio Grande,"Off of West Rim Rd/CB-115. Turn east (towards canyon) under the power lines. A few dirt roads shoot off from there, several spots along the rim with fire rings. Great view of the Rio Grande canyon and the Sangre de Cristo mountains to the east.",36.391568,-105.725922,2066.232666015625
"15099, Palm Avenue, Wasco, CAL Fire Kern County, CAL Fire Southern Region, California, 93280, United States",Roadside parking,"Big gravel pullout along N Palm Ave. Quiet road. Big rigs parked here already, plenty of room for all size rigs. Obviously nothing special but a good spot for a night off the beaten path ",35.606095,-119.349287,98.28433090168984
"Forest Road 315, El Paso County, Colorado, 80853, United States",Ridge Top ,"Forest Road 315 Split From Rampart Range Road.
A few established spots along the route.  
Excellent views in all directions. 
Cell Service (AT&T) is limited.
Warning:  Larger rigs be weary as roads are dirt single lanes. Turn around locations limited. Twisty climbs up to ridge location. ",39.034622,-105.005192,2831.927490234375
"Collier County, Florida, 34113, United States",Hidden parking area ,I believe this is an employee parking area during the day but at night no one is here. A diesel did come and stay on the other side but it was just us. You can go use the bathroom at Lowe’s if needed. Good spot to park overnight ,26.063051,-81.703285,5.631204605102539
"North New River Road, Phoenix, Maricopa County, Arizona, 85383, United States",Arizona Land Trust off New River Road,Good spot to spend the night. that’s about it. close to Lake Pleasant . Get your $21 pass on-line. police did come by on atv to check .,33.808068,-112.241497,493.6335105895996
"North Shore Drive, Fawnskin, San Bernardino County, California, 92333, United States",Roadside,"A little pull -off parking area (~150’x20’) where people park by the lake. There are not any “no parking“ signs and there are minimal residences across the street all of which are set back and higher up so it doesn’t feel intrusive. I wouldn’t suggest anything bigger than a 20’ vehicle or you might feel like you’re being more intrusive.

I parked just after sundown and maneuvered a bit to find a level spot. It’s the main road that runs adjacent to the lake, so there’s activity until early-mid evening, but eventually you won’t hear any cars passing by. It’s really just so serene!

I have T-Mobile and had 1-3 bars.

There are several other pull off areas along the main road, but this one seems to have the best access and view… all while feeling less intrusive.",34.24644,-116.97128,2053.676327573946
"Oatman-Topock Highway, Golden Shores, Mohave County, Arizona, 86436, United States",Oatman Hwy,"Spot for several big rigs close to hwy 10, and further down the road close to mtns.
The lack of respect for wild places is more apparent with every camp. There was excrement (incl. human) out in the open, enormous amounts of glass, cans, .22cal shells, and various unidentified objects.",34.953829,-114.409449,509.115478515625
"Hana Highway, Maui County, Hawaii, United States",Honomanu Bay,Local beach site- rough road right before a big corner- goes right to the beach.  Heard there’s sharks in the water here :),20.860589,-156.166422,25.81255824549013
"6216, West 5th Street, Banning, Riverside County, California, 92220, United States",Big gravel parking lots,"Lots of room for all size rigs. Lots of big rigs, vans and rvs here. Right next to highway.",33.927355,-116.944806,786.7919132467359
"Tonelea Trail, Yavapai County, Arizona, 86333, United States",Tonelea Trails dispersed sites,Nice site near Interstate 17 with great Verizon and AT&T reception. Part of Agua Adria Monument area. There’s a sign saying 4x4 needed but this is not necessary to reach some sites. Great view!,34.281176,-112.113524,1090.134853363037
"Peralta Road, Pinal County, Arizona, 85118, United States",Peralta Pullout,"Quiet, not quite level, plenty of room. Only wildlife was a big old longhorn cow who checked on us after sunset. Lots of other options along this road. Saturday morning this road was quite busy early with day hikers heading out to Wave Cave or Peralta, so it was worth it to try to be a little off the road or hidden. 2-4 bars for Verizon LTE",33.366613,-111.379362,630.2326212099654
"Sea Crest, North Forest Beach Drive, Forest Beach, Coligny, Hilton Head Island, Beaufort County, South Carolina, 29928, United States",Free Street Parking,"Noisy from all the shops but awesome spot!
No signs restricting overnight parking
Probably best to be low key at night",32.14311,-80.74996,3.6
"15839, Silver Springs Road, Mohave County, Arizona, 86401, United States",Stat Trust Land,"Not far from the highway! In a small bit of State Trust Land surrounded by private land.
There was already a small established fire ring and some wood.
",35.13925,-113.5583,0.0
"2348, North Rock Springs Drive, Inner Northwest, Las Vegas, Clark County, Nevada, 89128, United States",Rock Springs Drive,This is just off the freeway boondocking spot.  Easy on/off access.  Big rig compatible.  Lots of food options in walking distance.  4/5g cell service.  Will be good for a night or two if you're passing through and need a quick free spot to lay low. ,36.198793,-115.246768,2222.0
"Daylight Pass Road, Inyo County, California, United States",Daylight Pass Road,"Random turn-off for OHV road. Sign indicates 4x4 - high clearance and allows for camping after first mile. No fires. No toilets. 

Some extremely rocky parts I definitely wouldn’t try without A/T tires. Didn’t explore much and found a turn off just after the first mile. Quiet. Clean. Very scenic up off of Daylight Pass Rd. Perfect crash site between Death Valley NP and Rhyolite. I slept in the truck, ground and spiky bushes would probably make getting a tent down pretty rough. ",36.75054,-116.936519,1034.21686219424
"North Sonoita Highway, Pima County, Arizona, United States",Gunsight Wash BLM Area,"Free RV, car, and van camping. Stay limit 14 days. Pack it in pack it out. No facilities. Fire rings. Road in good condition. Many big rigs and a few vans. Many spots 50+. Road in mostly great condition. Spots go back for a mile or so. Little library near gate for book exchange. Some residents set up hummingbird feeders. Close to Organ pipe and Why. Enjoy!",32.240233,-112.753099,547.8939799470827
"33690, Shea Road, La Paz County, Arizona, 85344, United States",Osborne Wash on Shea Road,"Large gravel area with multiple fire rings along Shea Road. Some areas are a little Sandy bit nice area for big rigs, fifth wheels and our class A motorhome. Great cell coverage, antennas at top of mountain but if you drive half more you lose all coverage att and version. Tons of off road trails for Jeep’s and ATV’s",34.144608,-114.186891,186.51818437408656
"Mohave County, Arizona, United States",Craggy Wash 2 Mile,"14 day free BLM Land. Roads up until this point are quite good. Great location, still busy in Feb. good Verizon and TMobile cell signal. nice views.",34.593648,-114.335261,317.64764404296875
"Parking Area, I 10, Crockett County, Texas, United States",Parking area,Parking area on I-10. 24 hours parking permitted. Plenty of space for rigs of all sizes. Lighted. Free. Interstate traffic noise.,30.69793,-101.47365,0.0
"Nashville-Davidson, Davidson County, Tennessee, United States",Old Hickory Dam,"Spent a quiet, restful night here at the public parking lot.  The area is well used by fishermen, but they all left by evening.  There is a 5th wheel all set up and I thought it was maybe a security guard.  But the couple left around 5pm and, when I asked if I would park overnight they told me they had no jurisdiction and they don't care.  They said they doubted that anyone would bother us, and no one did.  There are restrooms here, but closed at the moment for winter.",36.296492,-86.659454,94.21856689453124
"Wilson Arch Road, San Juan County, Utah, United States",Steen Road pull offs,"Beautiful place in the utah desert. A few nice pull offs on a fairly nice dirt road. beware of cows in the road :) Accessable by almost any vehicle. Private Property signs and a fence on the right side of the road for a bit, but most of the road seems friendly to campers. 3 bars LTE of whatever service I have.",38.218693,-109.393072,1695.0
"Henderson, Chatham County, Georgia, 31416, United States",Cracker Barrel ,"Lot in back, not very flat. Fills up quickly, hotel next door takes spots. Enough room for vans and class B or small trailers if you get there early. ",32.004842,-81.277207,5.658829206600785
"Proctor Road, Pima County, Arizona, United States",Madera Canyon Proctor Rd Arizona,"Ten unimproved and private sites. Very rough rocky access over stream will bounce stuff from your cabinets, for about 3 blocks. Scrubby trees and grasses. Open area with 50 mile view to the west over Green Valley, AZ etc. Very pretty at night with city lights and glorious brilliant stars. It is a nice quiet camp area. It is our second year. We saw many deer and some javelinas last year. There are cows and their calves and this year they were a great nuisance, wanting to take back ""our"" site. Our trailer and SUV are covered with dirty slobber marks from the cows licking them the first night. We didn't get much sleep as they bumped the trailer all night. There are beautiful and easy hikes. An established NSF paved campground exists a few miles away at Madera Canyon. ",31.7408,-110.895247,1276.0
"Black Canyon Trail, Maricopa County, Arizona, United States",Table Mesa Road - Multiple spots,"This is a few miles in on a well maintained gravel road off HWY 17. There are multiple spots to camp, with rustic fire rings where others have been. Some spots have a lot of privacy, other spots will have UTV’s and Jeeps passing by to get to trails",33.988203,-112.170445,0.0
"Ridge Park Road, Newport Coast, Newport Beach, Orange County, CAL Fire Southern Region, California, 92657, United States",Ridge Park Rd,"This road goes to a park and to a trailhead. It’s free parking with no “no overnight parking” or street cleaning signs. A vanlife local let us know about it. It seems to be a common overnight spot and we weren’t hassled. There is a sign recommending to keep your vehicle locked and belongings secure, probably smash-and-grab style theft. The area felt safe and is very beautiful. Highly recommend! It’s up on a hilltop with great views.

Heavily trafficked with hikers starting early morning (5-6 am) especially on weekends. ",33.605731,-117.802708,308.0
"207, Arden Grove, Pearl, San Antonio, Bexar County, Texas, 78215, United States",Arden Grove St Parking,4-6 spots on Arden Grove St that have no prohibitions against parking 24/7 and being a one-way street with no traffic. Just a couple meters to the riverwalk yet quiet and secure. Occasional joggers and people walking their dog is all you get. Good AT&T and T-Mobile signal. Wyndham hotel across street has restroom if discreet about it and riverwalk south has public restrooms open daytime. Building next door has slow/medium public Spectrum wifi. ,29.435366,-98.483953,199.1748890494928
"Cracker Barrel, 15255, Crossroads Parkway, Crossroads Shopping Center, Gulfport, Harrison County, Mississippi, 39503, United States",Cracker Barrel ,A very quiet location. Manager said not to park in front of the dumpsters and I recommend staying closer to the Logan’s Steakhouse side as it’ll block some of the trash day noise. The only downfall is that you’ll go to bed hungry for steak. ,30.436506,-89.093376,6.611564663929816
"Vietnam Veteran's Memorial Highway, Sequoyah County, Oklahoma, 64948, United States",Sallisaw Rest Area. East Bound I40,"Standard rest area, good for one night. 

-No signs prohibiting overnight parking. 
-Park as far back as possible to avoid highway and truck idle noise. 

Note: Only added due to the other listing is stated as a tank dump water fill. Rest Area also on West Bound I40.",35.40683,-94.68111,174.13328813761473
"Pier 220 Seafood and Grill, 2A, Max Brewer Memorial Parkway, Titusville, Brevard County, Florida, 32796, United States",Pier 220 Under the Max Brewer Parkway.,"Many places to watch a launch in this area, this is where I ended up this evening for a 1:15am. launch. 

-No overnight parking restrictions, if fact it seems to be a van life spot. 

-Sandpoint park is next to this area if you need water, bathrooms, or a place for your kids to play. 
-Pier 220 Grill is open until 9 or 10 weekdays, later on weekends. 
-Your internet devise should work well here. 
-I parked on the dirt under the causeway facing the launch area.

-To check the upcoming launch schedule;
https://www.kennedyspacecenter.com/launches-and-events/events-calendar?pageindex=1

-Launch's do get scrubbed, check local media on the day of your visit.",28.61933,-80.80034,0.0
"Valley of the Gods Road, San Juan County, Utah, United States",Valley of the Gods,Valley of the Gods is one of the most beautiful BLM areas I think in the country. The fact that is hasn’t turned into a national park is astonishing. I could live here in my van. 10/10. This site was part of bears ears but is now BLM. no campfires allowed. no services. ,37.238671,-109.814461,1360.328469340056
"Kistler Memorial highway, McDowell County, North Carolina, United States",Small Site w/ View,"Small campsite with amazing view of Table Rock and the Gorge. It is right near the road, but the view is worth it. Rock fire ring. Trees for hammock camping. This is the best view right from the campsite that I found on NC-105. There are other larger campsites off the road a bit more, but they don’t offer the same view. Oh, and 2 bars of Verizon 4G LTE. ",35.87813,-81.909493,1010.419277191162
"Beaver Creek Road, Yavapai County, Arizona, 86342, United States",FS Rd 119/Montezuma Well Rd,"large, mostly level area with numerous loops could accommodate 10 or more large rigs.  no signs saying ""no camoing.""  2 entrances/exits.  5 bars AT&T. ",34.659754,-111.749407,1101.970458984375
"CAL Fire San Diego Unit, CAL Fire Southern Region, California, United States",Domeland Road turnout ,Just off the dirt & gravel road going to Domelands trailhead.  Located on a small hill with nice views.  This is within BLM land and you can camp free up to 14 days.  There is a flat level parking area next to a rock fire ring.  Road has soft sand and not recommended for RVs.  Pickup truck/camper or Jeep’s or 4x4 vans will be fine.  ,32.78941,-116.084423,247.2741388931477
"Bluff Springs Road, Escambia County, Florida, 32535, United States",Bluff Springs,There is a sign up online for free camping (which we did) but the campsites were tent only. So we parked down by the little boat launch and stayed for 3 nights with no issues. Verizon reception was OK (with booster). We were the only ones there that camped overnight and the few people that came were fishermen. No one bothered us.,30.935092,-87.272328,8.932329480565812
"Forest Road 542, Bernalillo County, New Mexico, 87059, United States",Cibola NF,"Nice quiet little spot in natural surroundings, off the road- a bit windy but peaceful. dispersed camping. Very Quiet. ",35.047824,-106.353811,2248.591796875
"Veterans Memorial Highway, Searchlight, Clark County, Nevada, 89046, United States",BLM South of Searchlight ,"large wide open flat area with fire pits. easily fit half a dozen rigs, probably more. but our friends and us were the only ones when we came. 
nice views of the hills and sunrise/sunsets. 
road in should be taken slow, few bumps here and there.  but it's hard- packed and easy to drive on. should be no problem for any vehicle. i pulled in a 30 foot trailer.

i suggest using satellite view to see the turn off and which way to go once off the main road. 

full service with Tmobile 

",35.401065,-114.898227,906.0
"Tooele County, Utah, United States",Deseret Peak Wilderness Area - North Willow Creek,"3 camping areas located right off the river with fire pits.
Well maintained with some cute areas to sit & enjoy the river. Very quiet, zero traffic besides me. Good trees for shade but also some open areas for camp setup. Some trash unfortunately, picked up what I could.
Can be a bit muddy and rocky (March) but manageable.
Very secluded & safe

Cell service 3-5 bars",40.532861,-112.573254,1794.76611328125
"Kane County, Utah, 84758, United States","k2 dispersed camping, beautiful","Awesome area just off rt 9, less than 15 min to zion.  Beautiful views, mostly flat, nice shrubs, fire pits, small restaurant 7 minutes away, decent Verizon cell service,  multiple spots to pick from, 2wd is fine. Take second left off side road to get in here. 5 stars",37.253143,-112.768755,1823.35009765625
"Holston Creek Road, Jones County, North Carolina, United States",End of Holston Creek Rd,Large clearing at end of road. Easy to drive here. Lots of wood around. We had good Verizon cell with a signal booster.,34.84344,-77.15993,0.0
"East Reno Avenue, Oklahoma City, Oklahoma County, Oklahoma, 73104, United States",Bass Pro Shops Outdoor World,Large parking lot in downtown Oklahoma City with amazing Centennial Land Run Monument (large bronze public art) adjacent to store parking. We stayed here in our 40ft converted school bus with no problems!,35.464058,-97.504368,398.7
