Location,Name,Description,Latitude,Longitude,Altitude,Map
"Inyo County, California, United States","""The Pads"" - Just outside Death Valley ","Spent the night here, conveniently close to Death Valley, right before you enter the fee area  for the National park. There was a short RV, and a few vans parked along the way too and no one had any trouble. There are no signs preventing overnight camping, and seems no one cares. Decent view, and fairly nice dirt road had no trouble with our transit or low clearance car. ",36.337991,-116.599614,921.4533508894964
"271, Dory Passage, Clearwater, Pinellas County, Florida, 33767, United States",Street Parking,"Lots of street parking on Dory Passage Street. No street signs on certain sections, safe neighborhood. Stayed one night in a Class C with no issues. ",27.979414,-82.818109,2.40591471362859
"Korean War Veterans Access Area, U.S. Route 2 North, Alburgh, Grand Isle County, Vermont, 12979, United States",US-2 ,"A turn out in the middle of the bridge from New York to Vermont, into a little knoll of land. If light traffic noise bothers you it might not be great but for me it was perfect and right on the water. A beautiful view and breeze all night and morning. Birds, boats and water, what more could you want. lol Oh and there's a porta potty if you use those. lol. Clean and safe. ",44.998752,-73.339625,15.78765869140625
"Field 2, WIlburton Hill Park Trails, Belridge, Bellevue, King County, Washington, 98005, United States",Wilburton Hill Park,Nice and quiet park. No signs for “No overnight parking”.,47.608648,-122.174512,58.56631088256836
"Larson Way, Gardnerville, Douglas County, Nevada, 89410, United States",Street Parking ,We stopped by Walmart to see if we can stay for the night but there were signs stating that no overnight parking so we saw few 18 wheels trucks in this street near to Walmart and we decided to parked and stay for the night nest to them. No signs and good for a night. T-mobile 2 bars of LTE. ,38.92197,-119.72056,1465.5738183008507
"Saltgrass Road, Clark County, Nevada, United States",Lovell Canyon with mountain views,"quite a few pull-offs along this dirt road. Road is in decent condition, made it fine with RWD but it's a little lop-sided at times. camp spot has great views, 2 bars ATT. Only con is that this spot is not very level. would've chosen somewhere else but this canyon is packed and I got here on a Thursday evening. ",36.065368,-115.552746,1575.60107421875
"Northshore Road, Clark County, Nevada, 89040, United States",Dispersed camping,"nice, big and fairly level camp spot not far down dirt road with fire ring. I wanted to go further for more privacy, but there are RVs at the end of this road and both right and left turns up the hill were too washed out for my RWD van to handle. This spot has great views and full ATT coverage. Can see main highway from it though. ",36.466668,-114.446788,469.88128662109375
"West Tehachapi Boulevard, Kern County, California, 93561, United States",Tehachapi CA road 202 freeway exit ,"A couple parking spots hidden behind three large boulders off the side of road 202 into Tehachapi. Road noise and train noise exist but a Great Mountain View. We stayed overnight in our van with no problems, there were also someone with a 5th wheel staying as well.",35.138782,-118.468663,1203.548166033812
"Forest Road 694, Town of Washburn, Bayfield County, Wisconsin, United States",Wild Camping off of FR 694,"There is a small clearing just off of FR 694 (north side of the road) with a small stone fire ring. Nice and quiet spot. Shady from all the trees. One bar of T-Mobile LTE. Fine for messages, not much else. Could probably fit a bigger rig here too. We were looking for the spot marked in iOverlander just west of this spot. There was nothing there but we found this a little further up the road. Thought I’d update with more accurate coordinates. ✌🏻",46.706951,-91.0462,398.5350486729712
"McDonald's, Main Street, Upper Village, Gorham, Coos County, New Hampshire, 03581, United States",mc Donald parking river,quiet place witch a beautiful river rock and forest beside mcdonalds. the wifi of the mcdo is free so its perfect.,44.393419,-71.185879,214.893310546875
"Chilton Road, Sweetwater County, Wyoming, United States",North of rock springs,"Two track off county road 17 with places to pull off. BLM land. No 4 wheel drive or high clearance necessary. Nothing fancy but did the trick for the night. Quiet, away from the main road, with decent Verizon and AT&T service. May be difficult to turn around with a big rig.",41.727081,-109.26476,1978.185648918152
"Spiral Jetty, Box Elder County, Utah, United States",Spiral Jetty wildcamp,"It is apparently allowed to wildcamp here. No signs saying otherwise. Cool spot, but lots of visitors coming and going into the night. No facilities. KEEP IT CLEAN. Nice to be here at sunrise, but lots of flies!",41.438251,-112.666315,1273.978515625
"Santa Fe Fire Road, San Bernardino County, California, United States",Fire road off of Old Woman Springs Road,"Gravel fire road that pulls off from Old Woman Springs Road. There's a couple of pullouts along it as well as a large open area at the beginning of the fire road. I camped here on a Thursday night and did not see anyone else, with just occasional cars going by on the main road. If you drive further down it is very quiet and peaceful, even right by the road was a nice spot. The road is packed gravel, not difficult to drive, most passenger cars should do fine.",34.424863,-116.788362,925.4580078125
"6795, South Saint Vrain Avenue, Estes Park, Larimer County, Colorado, 80517, United States",Pull-off - Longs Peak View,"Unfortunately the best options around here are either pull-offs on rt7 or drive forever down a bumpy dirt road. This pull-off is larger than most of the others because it's a little dirt parking lot to view the mountain. This means you can have ~20ft separation to the passing cars instead of ~5ft ;-)
Not perfectly level but good enough for me!",40.283368,-105.542842,2707.140380859375
"2011, Jefferson Avenue Northeast, Renton, King County, Washington, 98056, United States",Jefferson Avenue ,Nice quiet tree-lined street with no houses on either side. Street ends at apartment complex. No restrictions for parking. ,47.510804,-122.180304,117.72942315787076
"FR 50, Marion County, Florida, United States",Hopkins Prairie Remote Site,Small site off of a trail right next to the lake/marsh. Apple Maps didn’t recognize the trail but fits 3 tents and 2 trucks at least. Soft sand to get in. See photo for dusk views of this sight,29.272841,-81.707129,20.1163330078125
"East Perry Vickers Road, Government Camp, Clackamas County, Oregon, 97028, United States",Road Next To Trillium Lake,"PLENTY of spots all up and down the road in this area. Instead of going straight to get to Trillium Lake, take a right and there will be a road that has plenty of space on the left and right sides. Massive area with multiple vans and RV's when I pulled in. Right next to everything and still has service! One to two bars Verizon. Happy camping :)",45.282007,-121.736217,1109.008256775327
"Shoreline Highway, Marin County, CAL Fire Northern Region, California, 94970, United States",Pullout - Red Rock Beach ,"A bit before the parking for Red Rock Beach. Many people stay there, but if you prefer to have a more private place, this could be it. More level than the parking lot as well. It’s allowed to park here overnight. 

Note: the shoulder is a bit high for low cars. They can make it fine but just know its a bump. 

Fresh natural water source right across the street to fill uyour water bottles. ",37.886912,-122.628064,7.2
"Billings County, North Dakota, United States",Top of the world,The road coming in has several sites along the way.  We stayed at the very top of the road.  Beautiful views. ,46.942641,-103.575528,831.1201149895787
"808, Ranch to Market Road 2389, Mason County, Texas, 76856, United States",James River Riverbed,"Across the James River from Dos Rios campground is the James River public land use riverbed. Open for public use. No ATV/UTV use, be careful during flash floods. Good open areas but riverbed rocky. Stayed one night, quiet peaceful next to the river.  ",30.649231,-99.250091,404.5652312827895
"Hershey State Wildlife Management Area, South River Road, Lincoln County, Nebraska, 69143, United States",East end of the lake ,"Great little spot for an overnight but as people have mentioned it’s a little loud from the highway. 
Had full bars of Verizon service and if we had more time I’d love to go swimming and fishing. Thanks to this app we found this place and it was a lifesaver after almost hitting a deer on the main highway. ",41.134446,-100.983108,884.6037117671221
"BLM Campground, Kolob Resevoir Road, Virgin, Washington County, Utah, 84779, United States",BLM Camping,BLM campsite. 14 day maximum stay. Incredible view of the mountains. Just off North Kolob Terrace Road. Looks like it’s right next to a mountain biking trails. ,37.211595,-113.173545,1108.2601825883612
"The Goosenecks, San Juan County, Utah, United States",BLM Overlooking West Side of Goosenecks,"Great, isolated BLM campsite right on the cliff edge overlooking the west arm of the Goosenecks, but well outside of the park boundary. Take the road to Honaker trailhead off of Johns Canyon rd (244). There are 2 or 3 other cliffside sites on the section of road after the Honaker trailhead. Full bars of cell service. Great little firepit. Beautiful views. Road is a bit narrow/rough but likely do-able in high clearance 2wd. Likely (?) not suitable for big rigs based of a few sections of road being a bit steep. ",37.173149,-109.949049,1552.1337890625
"Centerpoint Trailhead, Centerpoint Trail, Newton County, Arkansas, 72624, United States",Center point to Goat Trail trailhead,"This is the Centerpoint trailhead parking lot. It’s a gravel parking lot, right off 43, that is a little secluded at night.  We’re in a Sprinter 144. Wouldn’t try much larger. Not much room to turn around. Stayed one night to hike next morning.  The local campsite doesn’t except RV’s.  There are no signs that say no overnight parking. ",36.063986,-93.360419,680.3194103713968
"Winding Stair Gap Road, Lumpkin County, Georgia, United States",Hillside Tree Ring,"This is an awesome spot secluded back off the main forest road with plenty of space. There is an established rock fire ring, a homemade table, plus a neat chair somebody made with a stump and vine branches. There’s quite a bit of dead trees around for firewood as well. Verizon LTE",34.617657,-84.147887,757.0336002316326
"Forest Service Rd 700, Coconino County, Arizona, United States",FS Rd 700 / Kelly Canyon East Huge Spot,Huge mostly flat area with established fire ring.  1 mile off hwy17. Entry road was recently re-graveled so my bus looked like it was covered in snow when i arrived with all the white dust. Road easy for big and small rigs. Only one rocky bit just before arrival. Spot large enough for several 40ft rvs with ease,35.059848,-111.674645,2074.996363608394
"County Highway 5, Wolf Hole, Mohave County, Arizona, United States",BLM close to St. George,"BLM Site alongside BLM Road 1069. Some sites with fire pits with a perfect view to the mountains. Only few traffic on the road. Make sure to get past the permit only zone and into the actual BLM land. You'll drive about 3 miles on dirt road, once you pass the cattle barrier, pullout on the left!",36.956531,-113.551654,918.697217239067
"Delle, Utah, Delle Frontage Road, Tooele County, Utah, 84029, United States",West of Shamrock station,Go through the large asphalt parking area on the west side of the shamrock station. You’ll see some black gravel roadways in the BLM land you can go on comfortably.  They are wide and easy we drove on them with our 45’ Rv with tow trailer total 71’.   It’s a bit further from the road and my dogs love the roaming and chasing rabbits.  Strong cell signal. ,40.761848,-112.786762,1295.8626597020775
"SR 173 Roadside Picnic Area, Camp Verde Road East, Camp Verde, Kerr County, Texas, 78010, United States",Penateka Picnic Area,"Maintained Picnic area in Camp Verde. Handicap accessible. Two Picnic tables with trash cans. Lots of shade trees. Access to river and historical marker on site. 
Camp Verde Restaurant and General Store is within walking distance, across the road.

Right off the highway so expect some road noise, but it's primarily local traffic that dies down in the evening. ",29.893199,-99.105137,463.9094848632813
"County Road 53, Juniper Hot Springs, Moffat County, Colorado, United States",Moffat County Public Land,"huge area, gravel Road 53, firepits, amazing views, for all Kind of campers, Max 14 days, wonderful quite, we were alone",40.505882,-107.943517,1953.0
"2/10 Road, Mesa County, Colorado, 81630, United States",Pyramid Rock ,"Free camping on BLM land across from Pyramid Rock (see photo). Two bars of 5G T-Mobile and about 50 yards off the dirt road. A few off road vehicles passed by and waved but zero traffic at night and very quiet.  
Tons of coyotes howling and a gorgeous spot for a sunset!",39.314114,-108.273273,1570.1189199667424
"North River Road, Wayne County, Utah, 84734, United States","Hanksville, Utah. ","Very large and isolated picnic area. On a very Sandy, dusty and careless road. But savage and wild beautiful. My 30 feet long RV got it with a little fear… Very quiet, no service at all. On west 24 hwy. ",38.386404,-110.715476,1316.556972503662
"FR 090, Garfield County, Utah, 84764, United States",Bryce Canyon Dispersed #5,Just off 63 in the NFS there are a number of dispersed camp sites.,37.655535,-112.17089,2376.301647180692
"1995, Brooklyn Road, Mount Tabor, Rutland County, Vermont, 05773, United States",AT Trailhead,"A wonderful spot in the White Rocks NRA with a fire ring. Turning east off US-7 onto Brooklyn Road, there are a number of pullouts large enough to comfortably accommodate a vehicle; I chose one for its proximity to the trailhead for a morning hike as well as the 3 bars VZN LTE. I only needed a block under one wheel to even the pitch to be nearly flat. Nearby is an overlook with a medium sized parking lot, paved, with a pit toilet. ",43.358278,-72.972129,374.8463857034221
"Graham County, Arizona, United States",Sand Tanks Rd 📶 ,Dispersed Camping on the side of the road up Sand Tank Rd. Beautiful views in every direction. There are two pulloffs at this location for small vehicles. One small fire ring. Three bars of Visible/Verizon service. ,32.831708,-110.202325,1652.3
"Beaufort Town Hall, 701, Front Street, Beaufort, Carteret County, North Carolina, 28516, United States","Beaufort, North Carolina","What a lovely old town bursting with boats, restaurants, breweries and fun things to see and do. 
We parked right along Front Street not far from all the shops. There are picnic tables here and garbage cans. There’s a public toilet to the west and if we stay here another night we may park closer. 
There are no “ no parking signs” I asked one of the shop owners if we’d be ok parking here overnight and she said we’d be fine. In the high season they bring in meters and might not allow it but in the month of November it seems to be fine. 
The Outer Banks are beautiful and might be worth reserving a boat ride over to explore them more closely. 
Fishtowne Brewery offers bingo every other Thursday! Check in to see if it’s on when you get here! You can bring in your own food ",34.715052,-76.662189,3.666935891605839
"National Forest Development Road 9720, Deschutes County, Oregon, United States",One of many pullouts on Lava Cast Road,So many places to pull out for a good nights sleep. It’s a good place to sleep between Newberry National Volcanic Monument and Bend.   ,43.865539,-121.385724,1387.367377076298
"Stampede Meadows Road, Truckee, Nevada County, California, United States",Near Boca Reservoir ,"All of the pullouts mentioned here were from the north bound lanes.  This place is accessed from the southbound lanes. Reno to Trukee. 
Take the Boca Reservoir exit, left at the T, go over the train tracks then take the road to the left again to the lookout over the little trukeee river before you get to the dam. 
We had a lovely quiet night.  2 trains before we went to sleep around 10:30 pm but other than that it was very quiet and the babbling Creek muffled any highway noise!
Highly recommend. ",39.386542,-120.094881,1686.8413113094866
"4199, Sunset Lane, Oxnard, Ventura County, CAL Fire Southern Region, California, 93035, United States",Sunset Lane,"nice quiet residential area, there were a few more vans parked on the street. no ""No parking"" signs, there was a porta potty at the parking lot next door, but it was locked. Very close to the ocean.",34.17628,-119.23513,7.1385783748701215
"River Road, Crockett County, Texas, 79781, United States",Cell tower pull out. ,"Massive gravel pull out with a bunch of bushes on it. We got here when it was pitch black outside, we drove it bit up the road but lost cell service pretty quick. This gravel spot has 3bars for Verizon (even though we’re 100meters from a cell tower) big enough for a couple bigger rigs. ",30.711049,-101.797566,644.4474793737754
"Granby Landing Road, Cayce, Lexington County, South Carolina, 20201, United States",Cayce Riverwalk Battlefield Connection ,Next to the Cayce Riverwalk Battlefield Connection. Large lot 200 yards x 200 yards with a boat ramp. Very nice biking and walking trail. Lit at night and very safe. No toilets or garbage. ,33.948262,-81.029847,40.96558503434062
"Badger Springs Road, Yavapai County, Arizona, United States",Badger Springs trail head,"Nice camp area just east at the end of the trailhead. There are a few campsites with firepits and easy to get to. Some freeway noise but otherwise quiet and out of view of the trailhead parking lot. The short hike down to the Agua Fria river is nice and has some good swim holes. Some cellphone signal, but down in a valley so a booster helps.",34.2323,-112.099329,930.65576171875
"Crisp County, Georgia, United States",Rocky Point Park,"A small park on the water.  No amenities. Very quiet.   Some locals came fishing but otherwise very quiet. 

Parking in the grass no paved lot. Mostly level. 

",31.84221,-83.897364,72.66263501439244
"Muley Point Road, San Juan County, Utah, United States",Valley of the Gods overview,"Nice view over Valley of the Gods, quiet",37.271977,-109.952022,1955.0
"County Road, Big Water, Kane County, Utah, United States",Big Water Gravel Area,"Large gravel area with a couple of established campfire rings. It's a large area just off NP-230 with spots for many rigs. We had no problem with our 40' fifth wheel. The sign at the entrance to NP-230 states camping rules for the Glen Canyon National Recreation Area. (pack out trash, self-contained, etc) There's an impressive view looking down over the valley below if you park on the east side. The dirt is a little soft on the rim so don't get too close or you could get stuck. 

With Starlink, we received 130mbps down and 3.5mbps up. Verizon signal on the phone was 5 bars. AT&T signal was 5 bars with our cell antenna.
(Speed update, 3/25/2023- Starlink was 30 Mbps down, 4-5 Mbps up; AT&T was 10-12 Mbps down, 1-2  Mbps up.)

FYI about the spot just to the east (where the water crosses the road), there's construction currently going on down there and the grade makes it near impossible to get into that spot. There's about a 6' sloped drop-off. It would be impossible for our big rig. Maybe a small camper van?? We can almost see that spot from where we are, but there's a hill in the way which does make it secluded.

We were able to get water at the Paria Contact Station. Be sure to get there before 4:30pm though because they close the gate. We had to lug 35 gallons in containers and pump it into our rig because we got there at about 5:30pm.",37.08086,-111.65544,1200.70166015625
"Ocean Avenue, Santa Monica, Los Angeles County, California, 90401, United States",Ocean Ave Street Parking ,"Street parking on ocean ave, the only sign says no parking noon-2pm on Wednesday. There’s a bathroom a little walks away at the park which closes at midnight and opens at 5 am. Decent spot! (I believe there is a height restriction, 8 ft) ",34.023368,-118.508686,43.03350316081196
"3864, TX 35, San Patricio County, Texas, 78336, United States",Picnic Area,"Three picnic pavilions with tables and trash cans.
Some shade in parking loop. Lots of road noise. Good patch of grass away from the highway for dog

Entrance is a sharp left off the highway; be cautious.",27.927046,-97.223373,-16.175811767578125
"Lees Ferry Road, Marble Canyon, Coconino County, Arizona, 86036, United States",Lee’s Ferry Road,Left side of the beginning of Lee’s Ferry Road there is a pump house. No sign that not allow parking or overnight stay. Some houses and a motel nearby. Very quiet in the night (only the pump house makes a little bit noise). ,36.818423,-111.637152,1091.542386717163
"Portsmouth Public Library, Parrott Avenue, Portsmouth, Rockingham County, New Hampshire, 03801, United States",street next to park,Nice quiet street next to a baseball field in a park.  No parking signs AT ALL! A few vans already here.  Across street from a really nice library!,43.071789,-70.759304,-15.739898681640623
"37436, South Shore Road, Madera County, California, 93604, United States",Bass Lake Dam,"At the south end of a beautiful alpine lake and a 28-mile drive south of Yosesmite NP, this is a parking spot on the actual dam with unobstructed views of the water and mountains. It is adjacent to a boat ramp with private plumbed bathrooms (so also sinks to fill water bottles). About a dozen cars a day used the parking lot to access the nice trailheads down to the spillway (a cool short hike) and to the forest. That said, we were the only overnight campers and basically had it to ourselves most of the weekend. We almost parked at the boat ramp but a park employee said that was $40 and the dam was free overnight parking. We hiked and kayaked right from our spot. We would highly recommend, the only downside was no shade but great views, proper bathrooms, full 5G cell coverage, and lots of outdoor rec opportunities, lots to love!",37.293819,-119.531835,983.0
"Cane Creek Recreation Road, Logan County, Arkansas, 72863, United States",Cane Creek Rec Area ,This place is WONDERFUL. Very secluded campground. No services so pack in and pack out. Boat launch right here and can park your boat right up to campsite. Locals are awesome. We met a couple named Kyle and Ann that live close by and just camp here in their free time. They welcomed us in and made us love Arkansas! We travel full time and they are some of the best people we have ever met. I highly recommend this campground. ,35.389755,-93.500715,103.55122830625623
"Sierra Vista Trail, Doña Ana County, New Mexico, United States",Sierra Vista ,"Past the roundabout of the other camping spots. Road a little rough, but doable with our 4x4 sprinter. Looks like there would be more spots further along the road, but the road is too rough for our van. Gorgeous views",32.318502,-106.631412,1475.1213370934129
"County Road 336, Stephens County, Texas, United States",Hubbard creek lake boat ramp & parking,"nice big, flat parking area at a public boat ramp. fishermen were here during the day, but quiet and deserted at night. not much here but trash cans, a kaibo and a shade structure. lovely view of the lake, amazing sunset, coyotes howling in the distance, and lots of mosquitoes. stopped at the place down the highway next to the bridge, but that spot was full of trash so we moved on.",32.768691,-99.071292,342.3837280273437
"Baylor Canyon Road, Doña Ana County, New Mexico, United States",alternate entrance to Baylor Canyon Rd Camping,"The spot and many others around it are part of a dirt and rock road that also lead to the other listing on iOverlander. I have found that this area, which is just as awesome as the area 3/4 miles away, is less busy and easier to access (the spots closer to the road anyhow, and I don’t mind the odd-car sleepy traffic on the main road, is far enough away). Amazing sunsets, beautiful views of Las Cruces down below, and you’re right in front of the Organ “Needles” - super dramatic and sharp mountain peaks. There’s homemade fire pits but otherwise no amenities. ",32.342425,-106.613444,1573.689843904522
"352, Tangerine Drive, Loxahatchee Groves, Palm Beach County, Florida, 33470, United States",ATV trail to open field,"This is really just an ATV trail but it leads to an open field.  Only really good for a quick overnight camp.  Full Verizon service.  Flat spots - just be mindful of the loose sand which is present in some areas.  Don’t try this with a big rig - you're going to get stuck.  There is a bathroom with flush toilet available in the park next door, just a short 5 minute walk.  

Best route into the spot begins at the corner of Loxahatchee Ave and Tangerine Drive.  ",26.6836,-80.269281,6.726254191718141
"1539, Edge Street, Monticello Park, Myrtle Beach, Horry County, South Carolina, 29577, United States",Secluded side street,"Secluded, shaded parking on a dead end street. It was quiet and peaceful. There’s a business at the end of this road called Sunbelt Landscaping. Staff started arriving and leaving between 6:00 and 7:00. No one disturbed us. ",33.708553,-78.887838,6.596034183166921
